<srcgen xmlns:xsi="http://www.w3.org/2001/XMLSchema-instance" xsi:noNamespaceSchemaLocation="./srcgen.xsd">
    <srcgen>
        <srcgen ipkg="edu.jhu.cs.bsj.stdlib.diagnostic" cpkg="edu.jhu.cs.bsj.stdlib.diagnostic.impl"
            itgt="bsjutils" ctgt="bsjutils">
            <userDiagnostic name="InvalidMetaAnnotationUseDiagnostic" super="BsjUtilDiagnostic">
                <prop name="metaAnnotationClass" type="Class&lt;? extends AbstractBsjMetaAnnotationMetaprogram&gt;"
                    desc="the class of meta-annotation that was used incorrectly" />
                <doc><![CDATA[
                    A diagnostic indicating that a meta-annotation is used incorrectly.
                ]]></doc>
            </userDiagnostic>

            <userDiagnostic name="InvalidAnnotatedDeclarationDiagnostic" super="InvalidMetaAnnotationUseDiagnostic"
                code="bsj.stdlib.metaannotation.invalid.declaration.type">
                <prop name="annotatedNode" type="Node" desc="the node that was annotated" />
                <prop name="legalTypes" type="List&lt;Class&lt;? extends Node&gt;&gt;"
                    desc="the legal types that could be annotated by the meta-annotation" />
                <messageProp expression="annotatedNode!=null?annotatedNode.getClass().getName():null" />
                <doc><![CDATA[
                    Indicates that the meta-annotation cannot be used on the specified type of node.  The
                    <code>annotatedNode</code> field is a hint and may be <code>null</code>.
                ]]></doc>
            </userDiagnostic>

            <userDiagnostic name="InvalidEnclosingTypeDiagnostic" super="InvalidMetaAnnotationUseDiagnostic"
                code="bsj.stdlib.metaannotation.invalid.enclosing.type">
                <prop name="node" type="TypeDeclarationNode" desc="the enclosing type declaration" />
                <prop name="legalTypes" type="List&lt;Class&lt;? extends TypeDeclarationNode&gt;&gt;"
                    desc="the legal types that could be annotated by the meta-annotation" />
                <messageProp expression="node!=null?node.getClass().getName():null" />
                <doc><![CDATA[
                    Indicates that the meta-annotation cannot be used in the enclosing type in which it is found.  The
                    <code>enclosingNode</code> field is a hint and may be <code>null</code> (especially if the
                    meta-annotation is attached to a code fragment and not a descendent of the root package).
                ]]></doc>
            </userDiagnostic>
        </srcgen>
    </srcgen>
</srcgen>